source_type,source_reference,workspace,severity,raw_content,summary,status,resulted_in,created_at,reviewed_at
audit,wf_audit_snapshot_daily,vizion-infra,info,Compact mirror. Source reference: wf_audit_snapshot_daily,Weekly audit completed cleanly. No drift detected. Wiki synced.,promoted,article,2026-03-10,2026-03-10
alert,UHmCR6VzI876gb75,vizion-trading,high,Compact mirror. Source reference: UHmCR6VzI876gb75,MT5 Demo rpyc server not responding on port 18812. Possible socat or Wine crash.,promoted,problem,2026-03-02,2026-03-02
analytics,wf_daily_cost_report f5xGCrMhztxWCvHr,vizion-infra,info,Compact mirror. Source reference: wf_daily_cost_report f5xGCrMhztxWCvHr,Daily AI cost report: $0.00 total. All traffic on Gemini free tier. OpenRouter inactive.,promoted,article,2026-03-10,2026-03-10
agent,openclaw-main,vizion-infra,medium,Compact mirror. Source reference: openclaw-main,OpenClaw answered a known problem from scratch — problem not yet in Library. Gap identified.,promoted,problem,2026-03-05,2026-03-05
maintenance,vizion-scheduling-runner.timer,vizion-infra,info,Compact mirror. Source reference: vizion-scheduling-runner.timer,Scheduled maintenance healthy. Platform task dispatch nominal.,discarded,none,2026-03-11,
alert,wf_threat_scan_6h b4GNV58JJ92rimO4,vizion-security,medium,Compact mirror. Source reference: wf_threat_scan_6h b4GNV58JJ92rimO4,SSH brute-force attempt blocked by firewall. IP 185.220.101.x. No successful auth.,in-review,,2026-03-09,
analytics,NNDataLogger.mqh,vizion-trading,info,Compact mirror. Source reference: NNDataLogger.mqh,Labeled trade rows are being captured from live MT5 closes. Retraining should wait until sample count is healthy.,promoted,recommendation,2026-03-26,2026-03-26
